课题分解,本月目标,本月关键成果,当前状态,里程碑交付物,交付物存档地址,课题名称,课题牵头人,课题owner,项目经理,风险等级,PMO评价,下月工作计划,展示材料,课题风险,应对计划,当前进展
10.1 1. 收集业务痛点，明确需求，完成技术方案设计。2. 梳理AI原子能力，明确技术路线，制定数字员工专项规划。3. 营造“人人愿用AI、人人会用AI、人人都用AI”的工作氛围。,,,,,,10. AI 数字化员工,李化,陈明垓,林跃,正常推进,关注委员会领导多次强调的【企业豆包】的建设规划及整体落地推进。,"1. 标题：信贷运营部
正文：中登网提前结清业务测试上线、调剂合同自动化出具上线。
2. 标题：审计部
正文：开展视频欺诈点检工作。
3. 标题：风险部
正文：完成 KPI 自动核算的验证与上线。
4. 标题：乘商营销部
正文：开展需求沟通，完成 ITBP 机制建立。",,,,
10.2 建设企业知识库,10.2.3 完成知识库（客服主题域梳理）开发，启动测试,持续推进客服主题域知识库测试中,🎉 提前完成,客服主题域知识库,,,,,,,,,,,,
10.3 投产分业务领域数字员工（数字合规官、财务数字人、采购数字人）,10.3.3 累计4个数字员工开发、测试、上线试运行,5. 完成中登网登记机器人RPA 6. 完成超链接替换等EXCEL工具,🎉 提前完成,中登网登记机器人、EXCEL工具,,,,,,,,,,,,
